<!--
# The root configuration node is called <opencms> for all OpenCms configurations.
-->
<!ELEMENT opencms (sites)>

<!--
# Configuration that controls individual sites in OpenCms.
# Each <site> sub-node of <sites> defines a site with the server name
# and the corresponding VFS-URI in OpenCms.
#
# workplace-server: the default server of the OpenCms workplace
# default-uri:      the default uri marks the site that is used when a request matches no defined site
# shared-folder:    the uri used for the shared folder, default="/shared/"
# site:             a site
#     server:       the server address used for the site
#     uri:          the absolute VFS path used for the site
#     title:        optional display title
#     position:     optional position for display order
#     errorPage:    absolute URI to an error page used for this site (optional)
#     webserver:    if set to true, a web-server configuration can be generated for this site
# secure:           an optional secure server for the site:
#     server:       the server address used for this site
#     exclusive:    if set to true, secure resources will only be available using the given secure url
#                   do not forget to configure an additional tomcat connector using
#                   proxyPort="443" scheme="https" secure="false"
#     error:        if exclusive, and set to true will generate a 404 error, if set to false will redirect to secure url
# alias:            alias servers for the site
#     server:       the server address used for this site
#     offset:       time in seconds added to the current time written as attribute
#                   into the session when accessing the site over this alias
-->
<!ELEMENT sites ((workplace-server+, default-uri, shared-folder?,oldStyleSecureServer?, webserver-scripting?, site+) | (workplace-server+, default-uri, oldStyleSecureServer?,webserver-scripting?, site+, shared-folder?))>
<!ELEMENT workplace-server (#PCDATA)>
<!ATTLIST workplace-server
	sslmode (no|manual|manual-ep-termination|lets-encrypt) "no">
<!ELEMENT default-uri (#PCDATA)>
<!ELEMENT oldStyleSecureServer (#PCDATA)>
<!ELEMENT webserver-scripting (webserverscript, targetpath, configtemplate,securetemplate, filenameprefix, loggingdir)>
<!ELEMENT webserverscript (#PCDATA)>
<!ELEMENT targetpath (#PCDATA)>
<!ELEMENT configtemplate (#PCDATA)>
<!ELEMENT securetemplate (#PCDATA)>
<!ELEMENT filenameprefix (#PCDATA)>
<!ELEMENT loggingdir (#PCDATA)>
<!ELEMENT shared-folder (#PCDATA)>
<!ELEMENT site (secure?, parameters?, alias*)>
<!ATTLIST site
	server CDATA #REQUIRED
	uri CDATA #REQUIRED
	title CDATA #IMPLIED
	position CDATA #IMPLIED
	errorPage CDATA #IMPLIED
	webserver (true|false|TRUE|FALSE) "true"
	sslmode (no|manual|manual-ep-termination|lets-encrypt|secure-server) "secure-server">
<!ELEMENT secure EMPTY>
<!ATTLIST secure
	server CDATA #REQUIRED
	exclusive (true|false|TRUE|FALSE) "false"
	error (true|false|TRUE|FALSE) "false"
	usePermanentRedirects (true|false|TRUE|FALSE) "false" 
	>
<!ELEMENT parameters (param*)>

<!ELEMENT param (#PCDATA)>
<!ATTLIST param name CDATA #REQUIRED>

<!ELEMENT alias EMPTY>	
<!ATTLIST alias
	server CDATA #REQUIRED
	redirect (true|false|True|False) "false"
	offset CDATA #IMPLIED>